{"format":"boris-astro-source-snapshot","schema_version":1,"tool_version":"0.8.1","source_system":"astro","project_id":"schema-fixture","selected_content_root":"src/content/docs","policy_hash":"034ae9dfa4ec47ad0a6cf2629eee2095df3ec41324d0912fa93462aaa7ba15c8","source_tree_fingerprint":"92542c1d40e0672fba4730db3b069f36a05cae01f404172e64feaf38fa45782e","records":[{"source_path":"valid.md","source_kind":"markdown","exact_byte_hash":"6432d81911ae01c11c032ad69c503607e85d01236be6d5b08d06845f587f0e01","frontmatter_hash":"5e622db1e67c15239435aa1a032eaa495ec209c85db000a2833a8e92eea8bb1b","body_hash":"55a677f01a01e55122b765b3ce394d37d567d0d76330eec93b9272aa189d65fc","symlink_target":null,"source_authored_identity":"schema/valid","inferred_route_candidate":"valid","route_evidence":"inferred_not_observed","references":[{"syntax":"inline_image","target":"/logo.svg","classification":"root_relative"},{"syntax":"inline_link","target":"./guide.md","classification":"source_relative"}],"potential_asset_references":[{"source_syntax":"inline_image","target":"/logo.svg","classification":"root_relative"}],"classification":"create","evidence":"supported_plain_markdown"}]}
